{
  "schema": "trace-harness/analysis@3",
  "trace_id": "abc123fixturetrace0000000000000001",
  "span_count": 6,
  "measurements": {
    "specs": [
      {
        "scope": "node",
        "units": {
          "self_ms": "ms"
        },
        "description": "Node duration not covered by direct children, clipped to the node interval.",
        "dimensions": [],
        "kind": "self_ms"
      },
      {
        "scope": "node",
        "units": {
          "count": "call",
          "duration_sum_ms": "ms",
          "covered_ms": "ms"
        },
        "description": "Calls started from earliest observed trace start through anchor end; in-flight durations clipped. Kind coverage can overlap.",
        "dimensions": [
          "call_kind"
        ],
        "kind": "calls_until_node_end"
      }
    ],
    "sources": [
      {
        "id": "1111111111111111",
        "kind": "agent",
        "start_ms": 1700000000000.0,
        "end_ms": 1700000008000.0,
        "node_id": "1111111111111111",
        "span_ids": [
          "1111111111111111"
        ]
      },
      {
        "id": "2222222222222222",
        "kind": "model-call",
        "start_ms": 1700000000100.0,
        "end_ms": 1700000003500.0,
        "node_id": "2222222222222222",
        "span_ids": [
          "2222222222222222"
        ]
      },
      {
        "id": "3333333333333333",
        "kind": "http",
        "start_ms": 1700000000150.0,
        "end_ms": 1700000003450.0,
        "node_id": "3333333333333333",
        "span_ids": [
          "3333333333333333"
        ]
      },
      {
        "id": "4444444444444444",
        "kind": "tool-call",
        "start_ms": 1700000003600.0,
        "end_ms": 1700000004800.0,
        "node_id": "4444444444444444",
        "span_ids": [
          "4444444444444444"
        ]
      },
      {
        "id": "5555555555555555",
        "kind": "model-call",
        "start_ms": 1700000004900.0,
        "end_ms": 1700000007400.0,
        "node_id": "5555555555555555",
        "span_ids": [
          "5555555555555555"
        ]
      },
      {
        "id": "6666666666666666",
        "kind": "http",
        "start_ms": 1700000004950.0,
        "end_ms": 1700000007350.0,
        "node_id": "6666666666666666",
        "span_ids": [
          "6666666666666666"
        ]
      }
    ],
    "nodes": {
      "1111111111111111": [
        {
          "kind": "self_ms",
          "node_id": "1111111111111111",
          "status": "measured",
          "values": {
            "self_ms": 900.0
          },
          "evidence": {
            "source": "direct_children",
            "node_id": "1111111111111111"
          },
          "error": null
        },
        {
          "kind": "calls_until_node_end",
          "node_id": "1111111111111111",
          "status": "measured",
          "values": {
            "agent": {
              "count": 1,
              "duration_sum_ms": 8000.0,
              "covered_ms": 8000.0
            },
            "http": {
              "count": 2,
              "duration_sum_ms": 5700.0,
              "covered_ms": 5700.0
            },
            "model-call": {
              "count": 2,
              "duration_sum_ms": 5900.0,
              "covered_ms": 5900.0
            },
            "tool-call": {
              "count": 1,
              "duration_sum_ms": 1200.0,
              "covered_ms": 1200.0
            }
          },
          "evidence": {
            "source": "calls",
            "start_ms": 1700000000000.0,
            "end_ms": 1700000008000.0
          },
          "error": null
        }
      ],
      "5555555555555555": [
        {
          "kind": "self_ms",
          "node_id": "5555555555555555",
          "status": "measured",
          "values": {
            "self_ms": 100.0
          },
          "evidence": {
            "source": "direct_children",
            "node_id": "5555555555555555"
          },
          "error": null
        },
        {
          "kind": "calls_until_node_end",
          "node_id": "5555555555555555",
          "status": "measured",
          "values": {
            "agent": {
              "count": 1,
              "duration_sum_ms": 7400.0,
              "covered_ms": 7400.0
            },
            "http": {
              "count": 2,
              "duration_sum_ms": 5700.0,
              "covered_ms": 5700.0
            },
            "model-call": {
              "count": 2,
              "duration_sum_ms": 5900.0,
              "covered_ms": 5900.0
            },
            "tool-call": {
              "count": 1,
              "duration_sum_ms": 1200.0,
              "covered_ms": 1200.0
            }
          },
          "evidence": {
            "source": "calls",
            "start_ms": 1700000000000.0,
            "end_ms": 1700000007400.0
          },
          "error": null
        }
      ],
      "3333333333333333": [
        {
          "kind": "self_ms",
          "node_id": "3333333333333333",
          "status": "measured",
          "values": {
            "self_ms": 3300.0
          },
          "evidence": {
            "source": "direct_children",
            "node_id": "3333333333333333"
          },
          "error": null
        },
        {
          "kind": "calls_until_node_end",
          "node_id": "3333333333333333",
          "status": "measured",
          "values": {
            "agent": {
              "count": 1,
              "duration_sum_ms": 3450.0,
              "covered_ms": 3450.0
            },
            "http": {
              "count": 1,
              "duration_sum_ms": 3300.0,
              "covered_ms": 3300.0
            },
            "model-call": {
              "count": 1,
              "duration_sum_ms": 3350.0,
              "covered_ms": 3350.0
            },
            "tool-call": {
              "count": 0,
              "duration_sum_ms": 0.0,
              "covered_ms": 0.0
            }
          },
          "evidence": {
            "source": "calls",
            "start_ms": 1700000000000.0,
            "end_ms": 1700000003450.0
          },
          "error": null
        }
      ],
      "2222222222222222": [
        {
          "kind": "self_ms",
          "node_id": "2222222222222222",
          "status": "measured",
          "values": {
            "self_ms": 100.0
          },
          "evidence": {
            "source": "direct_children",
            "node_id": "2222222222222222"
          },
          "error": null
        },
        {
          "kind": "calls_until_node_end",
          "node_id": "2222222222222222",
          "status": "measured",
          "values": {
            "agent": {
              "count": 1,
              "duration_sum_ms": 3500.0,
              "covered_ms": 3500.0
            },
            "http": {
              "count": 1,
              "duration_sum_ms": 3300.0,
              "covered_ms": 3300.0
            },
            "model-call": {
              "count": 1,
              "duration_sum_ms": 3400.0,
              "covered_ms": 3400.0
            },
            "tool-call": {
              "count": 0,
              "duration_sum_ms": 0.0,
              "covered_ms": 0.0
            }
          },
          "evidence": {
            "source": "calls",
            "start_ms": 1700000000000.0,
            "end_ms": 1700000003500.0
          },
          "error": null
        }
      ],
      "6666666666666666": [
        {
          "kind": "self_ms",
          "node_id": "6666666666666666",
          "status": "measured",
          "values": {
            "self_ms": 2400.0
          },
          "evidence": {
            "source": "direct_children",
            "node_id": "6666666666666666"
          },
          "error": null
        },
        {
          "kind": "calls_until_node_end",
          "node_id": "6666666666666666",
          "status": "measured",
          "values": {
            "agent": {
              "count": 1,
              "duration_sum_ms": 7350.0,
              "covered_ms": 7350.0
            },
            "http": {
              "count": 2,
              "duration_sum_ms": 5700.0,
              "covered_ms": 5700.0
            },
            "model-call": {
              "count": 2,
              "duration_sum_ms": 5850.0,
              "covered_ms": 5850.0
            },
            "tool-call": {
              "count": 1,
              "duration_sum_ms": 1200.0,
              "covered_ms": 1200.0
            }
          },
          "evidence": {
            "source": "calls",
            "start_ms": 1700000000000.0,
            "end_ms": 1700000007350.0
          },
          "error": null
        }
      ],
      "4444444444444444": [
        {
          "kind": "self_ms",
          "node_id": "4444444444444444",
          "status": "measured",
          "values": {
            "self_ms": 1200.0
          },
          "evidence": {
            "source": "direct_children",
            "node_id": "4444444444444444"
          },
          "error": null
        },
        {
          "kind": "calls_until_node_end",
          "node_id": "4444444444444444",
          "status": "measured",
          "values": {
            "agent": {
              "count": 1,
              "duration_sum_ms": 4800.0,
              "covered_ms": 4800.0
            },
            "http": {
              "count": 1,
              "duration_sum_ms": 3300.0,
              "covered_ms": 3300.0
            },
            "model-call": {
              "count": 1,
              "duration_sum_ms": 3400.0,
              "covered_ms": 3400.0
            },
            "tool-call": {
              "count": 1,
              "duration_sum_ms": 1200.0,
              "covered_ms": 1200.0
            }
          },
          "evidence": {
            "source": "calls",
            "start_ms": 1700000000000.0,
            "end_ms": 1700000004800.0
          },
          "error": null
        }
      ]